[
  {
    "id": "u6",
    "t_start": 14500,
    "t_end": 15865,
    "text": "cuando le doy a guardar tarda un montón",
    "lang": "es",
    "words": [
      {
        "w": "cuando",
        "t": 14500,
        "d": 80,
        "p": 0.97
      },
      {
        "w": "le",
        "t": 14590,
        "d": 80,
        "p": 0.97
      },
      {
        "w": "doy",
        "t": 14680,
        "d": 80,
        "p": 0.97
      },
      {
        "w": "a",
        "t": 14770,
        "d": 80,
        "p": 0.97
      },
      {
        "w": "guardar",
        "t": 14860,
        "d": 80,
        "p": 0.97
      },
      {
        "w": "tarda",
        "t": 14950,
        "d": 80,
        "p": 0.97
      },
      {
        "w": "un",
        "t": 15040,
        "d": 80,
        "p": 0.97
      },
      {
        "w": "montón",
        "t": 15130,
        "d": 80,
        "p": 0.97
      }
    ],
    "avg_logprob": -0.12,
    "no_speech_prob": 0.03,
    "marked": false
  }
]
