[
  {
    "id": "u20",
    "t_start": 21500,
    "t_end": 22445,
    "text": "en general la app se ve mal",
    "lang": "es",
    "words": [
      {
        "w": "en",
        "t": 21500,
        "d": 80,
        "p": 0.97
      },
      {
        "w": "general",
        "t": 21590,
        "d": 80,
        "p": 0.97
      },
      {
        "w": "la",
        "t": 21680,
        "d": 80,
        "p": 0.97
      },
      {
        "w": "app",
        "t": 21770,
        "d": 80,
        "p": 0.97
      },
      {
        "w": "se",
        "t": 21860,
        "d": 80,
        "p": 0.97
      },
      {
        "w": "ve",
        "t": 21950,
        "d": 80,
        "p": 0.97
      },
      {
        "w": "mal",
        "t": 22040,
        "d": 80,
        "p": 0.97
      }
    ],
    "avg_logprob": -0.12,
    "no_speech_prob": 0.03,
    "marked": false
  }
]
