[
  {
    "id": "u03",
    "t_start": 20000,
    "t_end": 21610,
    "text": "acá falta un espacio antes del texto del botón",
    "lang": "es",
    "words": [
      {
        "w": "acá",
        "t": 20000,
        "d": 80,
        "p": 0.97
      },
      {
        "w": "falta",
        "t": 20090,
        "d": 80,
        "p": 0.97
      },
      {
        "w": "un",
        "t": 20180,
        "d": 80,
        "p": 0.97
      },
      {
        "w": "espacio",
        "t": 20270,
        "d": 80,
        "p": 0.97
      },
      {
        "w": "antes",
        "t": 20360,
        "d": 80,
        "p": 0.97
      },
      {
        "w": "del",
        "t": 20450,
        "d": 80,
        "p": 0.97
      },
      {
        "w": "texto",
        "t": 20540,
        "d": 80,
        "p": 0.97
      },
      {
        "w": "del",
        "t": 20630,
        "d": 80,
        "p": 0.97
      },
      {
        "w": "botón",
        "t": 20720,
        "d": 80,
        "p": 0.97
      }
    ],
    "avg_logprob": -0.12,
    "no_speech_prob": 0.03,
    "marked": false
  }
]
