[
  {
    "id": "u11",
    "t_start": 17000,
    "t_end": 18470,
    "text": "esta pantalla necesita un título más claro",
    "lang": "es",
    "words": [
      {
        "w": "esta",
        "t": 17000,
        "d": 80,
        "p": 0.97
      },
      {
        "w": "pantalla",
        "t": 17090,
        "d": 80,
        "p": 0.97
      },
      {
        "w": "necesita",
        "t": 17180,
        "d": 80,
        "p": 0.97
      },
      {
        "w": "un",
        "t": 17270,
        "d": 80,
        "p": 0.97
      },
      {
        "w": "título",
        "t": 17360,
        "d": 80,
        "p": 0.97
      },
      {
        "w": "más",
        "t": 17450,
        "d": 80,
        "p": 0.97
      },
      {
        "w": "claro",
        "t": 17540,
        "d": 80,
        "p": 0.97
      }
    ],
    "avg_logprob": -0.12,
    "no_speech_prob": 0.03,
    "marked": false
  }
]
