[
  {
    "id": "u14",
    "t_start": 7300,
    "t_end": 8560,
    "text": "cuando hago clic acá tarda demasiado",
    "lang": "es",
    "words": [
      {
        "w": "cuando",
        "t": 7300,
        "d": 80,
        "p": 0.97
      },
      {
        "w": "hago",
        "t": 7390,
        "d": 80,
        "p": 0.97
      },
      {
        "w": "clic",
        "t": 7480,
        "d": 80,
        "p": 0.97
      },
      {
        "w": "acá",
        "t": 7570,
        "d": 80,
        "p": 0.97
      },
      {
        "w": "tarda",
        "t": 7660,
        "d": 80,
        "p": 0.97
      },
      {
        "w": "demasiado",
        "t": 7750,
        "d": 80,
        "p": 0.97
      }
    ],
    "avg_logprob": -0.12,
    "no_speech_prob": 0.03,
    "marked": false
  }
]
