[
  {
    "id": "u13",
    "t_start": 18000,
    "t_end": 18805,
    "text": "este botón es muy chico",
    "lang": "es",
    "words": [
      {
        "w": "este",
        "t": 18000,
        "d": 80,
        "p": 0.97
      },
      {
        "w": "botón",
        "t": 18090,
        "d": 80,
        "p": 0.97
      },
      {
        "w": "es",
        "t": 18180,
        "d": 80,
        "p": 0.97
      },
      {
        "w": "muy",
        "t": 18270,
        "d": 80,
        "p": 0.97
      },
      {
        "w": "chico",
        "t": 18360,
        "d": 80,
        "p": 0.97
      }
    ],
    "avg_logprob": -0.12,
    "no_speech_prob": 0.03,
    "marked": false
  }
]
