[
  {
    "id": "u24",
    "t_start": 20000,
    "t_end": 21715,
    "text": "este botón no se ve bien, parece que quedó tapado",
    "lang": "es",
    "words": [
      {
        "w": "este",
        "t": 20000,
        "d": 80,
        "p": 0.97
      },
      {
        "w": "botón",
        "t": 20090,
        "d": 80,
        "p": 0.97
      },
      {
        "w": "no",
        "t": 20180,
        "d": 80,
        "p": 0.97
      },
      {
        "w": "se",
        "t": 20270,
        "d": 80,
        "p": 0.97
      },
      {
        "w": "ve",
        "t": 20360,
        "d": 80,
        "p": 0.97
      },
      {
        "w": "bien,",
        "t": 20450,
        "d": 80,
        "p": 0.97
      },
      {
        "w": "parece",
        "t": 20540,
        "d": 80,
        "p": 0.97
      },
      {
        "w": "que",
        "t": 20630,
        "d": 80,
        "p": 0.97
      },
      {
        "w": "quedó",
        "t": 20720,
        "d": 80,
        "p": 0.97
      },
      {
        "w": "tapado",
        "t": 20810,
        "d": 80,
        "p": 0.97
      }
    ],
    "avg_logprob": -0.12,
    "no_speech_prob": 0.03,
    "marked": false
  }
]
