[
  {
    "id": "u01",
    "t_start": 20000,
    "t_end": 21785,
    "text": "este botón de nuevo turno queda muy chico en mobile",
    "lang": "es",
    "words": [
      {
        "w": "este",
        "t": 20000,
        "d": 80,
        "p": 0.97
      },
      {
        "w": "botón",
        "t": 20090,
        "d": 80,
        "p": 0.97
      },
      {
        "w": "de",
        "t": 20180,
        "d": 80,
        "p": 0.97
      },
      {
        "w": "nuevo",
        "t": 20270,
        "d": 80,
        "p": 0.97
      },
      {
        "w": "turno",
        "t": 20360,
        "d": 80,
        "p": 0.97
      },
      {
        "w": "queda",
        "t": 20450,
        "d": 80,
        "p": 0.97
      },
      {
        "w": "muy",
        "t": 20540,
        "d": 80,
        "p": 0.97
      },
      {
        "w": "chico",
        "t": 20630,
        "d": 80,
        "p": 0.97
      },
      {
        "w": "en",
        "t": 20720,
        "d": 80,
        "p": 0.97
      },
      {
        "w": "mobile",
        "t": 20810,
        "d": 80,
        "p": 0.97
      }
    ],
    "avg_logprob": -0.12,
    "no_speech_prob": 0.03,
    "marked": false
  }
]
