[
  {
    "id": "u25",
    "t_start": 20000,
    "t_end": 22065,
    "text": "cuando le doy a cerrar la caja tarda un montón en confirmar",
    "lang": "es",
    "words": [
      {
        "w": "cuando",
        "t": 20000,
        "d": 80,
        "p": 0.97
      },
      {
        "w": "le",
        "t": 20090,
        "d": 80,
        "p": 0.97
      },
      {
        "w": "doy",
        "t": 20180,
        "d": 80,
        "p": 0.97
      },
      {
        "w": "a",
        "t": 20270,
        "d": 80,
        "p": 0.97
      },
      {
        "w": "cerrar",
        "t": 20360,
        "d": 80,
        "p": 0.97
      },
      {
        "w": "la",
        "t": 20450,
        "d": 80,
        "p": 0.97
      },
      {
        "w": "caja",
        "t": 20540,
        "d": 80,
        "p": 0.97
      },
      {
        "w": "tarda",
        "t": 20630,
        "d": 80,
        "p": 0.97
      },
      {
        "w": "un",
        "t": 20720,
        "d": 80,
        "p": 0.97
      },
      {
        "w": "montón",
        "t": 20810,
        "d": 80,
        "p": 0.97
      },
      {
        "w": "en",
        "t": 20900,
        "d": 80,
        "p": 0.97
      },
      {
        "w": "confirmar",
        "t": 20990,
        "d": 80,
        "p": 0.97
      }
    ],
    "avg_logprob": -0.12,
    "no_speech_prob": 0.03,
    "marked": false
  },
  {
    "id": "u125",
    "t_start": 22865,
    "t_end": 24930,
    "text": "otra cosa, el título de la sección de caja está mal escrito",
    "lang": "es",
    "words": [
      {
        "w": "otra",
        "t": 22865,
        "d": 80,
        "p": 0.97
      },
      {
        "w": "cosa,",
        "t": 22955,
        "d": 80,
        "p": 0.97
      },
      {
        "w": "el",
        "t": 23045,
        "d": 80,
        "p": 0.97
      },
      {
        "w": "título",
        "t": 23135,
        "d": 80,
        "p": 0.97
      },
      {
        "w": "de",
        "t": 23225,
        "d": 80,
        "p": 0.97
      },
      {
        "w": "la",
        "t": 23315,
        "d": 80,
        "p": 0.97
      },
      {
        "w": "sección",
        "t": 23405,
        "d": 80,
        "p": 0.97
      },
      {
        "w": "de",
        "t": 23495,
        "d": 80,
        "p": 0.97
      },
      {
        "w": "caja",
        "t": 23585,
        "d": 80,
        "p": 0.97
      },
      {
        "w": "está",
        "t": 23675,
        "d": 80,
        "p": 0.97
      },
      {
        "w": "mal",
        "t": 23765,
        "d": 80,
        "p": 0.97
      },
      {
        "w": "escrito",
        "t": 23855,
        "d": 80,
        "p": 0.97
      }
    ],
    "avg_logprob": -0.12,
    "no_speech_prob": 0.03,
    "marked": false
  }
]
