[
  {
    "id": "u21",
    "t_start": 20000,
    "t_end": 21995,
    "text": "este botón de nuevo turno tapa el encabezado de la semana",
    "lang": "es",
    "words": [
      {
        "w": "este",
        "t": 20000,
        "d": 80,
        "p": 0.97
      },
      {
        "w": "botón",
        "t": 20090,
        "d": 80,
        "p": 0.97
      },
      {
        "w": "de",
        "t": 20180,
        "d": 80,
        "p": 0.97
      },
      {
        "w": "nuevo",
        "t": 20270,
        "d": 80,
        "p": 0.97
      },
      {
        "w": "turno",
        "t": 20360,
        "d": 80,
        "p": 0.97
      },
      {
        "w": "tapa",
        "t": 20450,
        "d": 80,
        "p": 0.97
      },
      {
        "w": "el",
        "t": 20540,
        "d": 80,
        "p": 0.97
      },
      {
        "w": "encabezado",
        "t": 20630,
        "d": 80,
        "p": 0.97
      },
      {
        "w": "de",
        "t": 20720,
        "d": 80,
        "p": 0.97
      },
      {
        "w": "la",
        "t": 20810,
        "d": 80,
        "p": 0.97
      },
      {
        "w": "semana",
        "t": 20900,
        "d": 80,
        "p": 0.97
      }
    ],
    "avg_logprob": -0.12,
    "no_speech_prob": 0.03,
    "marked": false
  }
]
