[
  {
    "id": "u05",
    "t_start": 20000,
    "t_end": 21890,
    "text": "ahí quedó todo amontonado, ese ícono sobra en el medio",
    "lang": "es",
    "words": [
      {
        "w": "ahí",
        "t": 20000,
        "d": 80,
        "p": 0.97
      },
      {
        "w": "quedó",
        "t": 20090,
        "d": 80,
        "p": 0.97
      },
      {
        "w": "todo",
        "t": 20180,
        "d": 80,
        "p": 0.97
      },
      {
        "w": "amontonado,",
        "t": 20270,
        "d": 80,
        "p": 0.97
      },
      {
        "w": "ese",
        "t": 20360,
        "d": 80,
        "p": 0.97
      },
      {
        "w": "ícono",
        "t": 20450,
        "d": 80,
        "p": 0.97
      },
      {
        "w": "sobra",
        "t": 20540,
        "d": 80,
        "p": 0.97
      },
      {
        "w": "en",
        "t": 20630,
        "d": 80,
        "p": 0.97
      },
      {
        "w": "el",
        "t": 20720,
        "d": 80,
        "p": 0.97
      },
      {
        "w": "medio",
        "t": 20810,
        "d": 80,
        "p": 0.97
      }
    ],
    "avg_logprob": -0.12,
    "no_speech_prob": 0.03,
    "marked": false
  }
]
