[
  {
    "id": "u26",
    "t_start": 20000,
    "t_end": 21610,
    "text": "señal espuria captada por el micrófono abierto",
    "lang": "es",
    "words": [
      {
        "w": "señal",
        "t": 20000,
        "d": 80,
        "p": 0.97
      },
      {
        "w": "espuria",
        "t": 20090,
        "d": 80,
        "p": 0.97
      },
      {
        "w": "captada",
        "t": 20180,
        "d": 80,
        "p": 0.97
      },
      {
        "w": "por",
        "t": 20270,
        "d": 80,
        "p": 0.97
      },
      {
        "w": "el",
        "t": 20360,
        "d": 80,
        "p": 0.97
      },
      {
        "w": "micrófono",
        "t": 20450,
        "d": 80,
        "p": 0.97
      },
      {
        "w": "abierto",
        "t": 20540,
        "d": 80,
        "p": 0.97
      }
    ],
    "avg_logprob": -0.12,
    "no_speech_prob": 0.7,
    "marked": false
  }
]
