[
  {
    "id": "u27",
    "t_start": 19600,
    "t_end": 21315,
    "text": "este botón de confirmar quedó tapado por el modal",
    "lang": "es",
    "words": [
      {
        "w": "este",
        "t": 19600,
        "d": 80,
        "p": 0.97
      },
      {
        "w": "botón",
        "t": 19690,
        "d": 80,
        "p": 0.97
      },
      {
        "w": "de",
        "t": 19780,
        "d": 80,
        "p": 0.97
      },
      {
        "w": "confirmar",
        "t": 19870,
        "d": 80,
        "p": 0.97
      },
      {
        "w": "quedó",
        "t": 19960,
        "d": 80,
        "p": 0.97
      },
      {
        "w": "tapado",
        "t": 20050,
        "d": 80,
        "p": 0.97
      },
      {
        "w": "por",
        "t": 20140,
        "d": 80,
        "p": 0.97
      },
      {
        "w": "el",
        "t": 20230,
        "d": 80,
        "p": 0.97
      },
      {
        "w": "modal",
        "t": 20320,
        "d": 80,
        "p": 0.97
      }
    ],
    "avg_logprob": -0.12,
    "no_speech_prob": 0.03,
    "marked": true
  }
]
