[
  {
    "id": "u16",
    "t_start": 20000,
    "t_end": 21715,
    "text": "en general la app se ve un poco anticuada todavía",
    "lang": "es",
    "words": [
      {
        "w": "en",
        "t": 20000,
        "d": 80,
        "p": 0.97
      },
      {
        "w": "general",
        "t": 20090,
        "d": 80,
        "p": 0.97
      },
      {
        "w": "la",
        "t": 20180,
        "d": 80,
        "p": 0.97
      },
      {
        "w": "app",
        "t": 20270,
        "d": 80,
        "p": 0.97
      },
      {
        "w": "se",
        "t": 20360,
        "d": 80,
        "p": 0.97
      },
      {
        "w": "ve",
        "t": 20450,
        "d": 80,
        "p": 0.97
      },
      {
        "w": "un",
        "t": 20540,
        "d": 80,
        "p": 0.97
      },
      {
        "w": "poco",
        "t": 20630,
        "d": 80,
        "p": 0.97
      },
      {
        "w": "anticuada",
        "t": 20720,
        "d": 80,
        "p": 0.97
      },
      {
        "w": "todavía",
        "t": 20810,
        "d": 80,
        "p": 0.97
      }
    ],
    "avg_logprob": -0.12,
    "no_speech_prob": 0.03,
    "marked": false
  }
]
