[
  {
    "id": "u23",
    "t_start": 20000,
    "t_end": 21645,
    "text": "este panel se ve raro comparado con el anterior",
    "lang": "es",
    "words": [
      {
        "w": "este",
        "t": 20000,
        "d": 80,
        "p": 0.97
      },
      {
        "w": "panel",
        "t": 20090,
        "d": 80,
        "p": 0.97
      },
      {
        "w": "se",
        "t": 20180,
        "d": 80,
        "p": 0.97
      },
      {
        "w": "ve",
        "t": 20270,
        "d": 80,
        "p": 0.97
      },
      {
        "w": "raro",
        "t": 20360,
        "d": 80,
        "p": 0.97
      },
      {
        "w": "comparado",
        "t": 20450,
        "d": 80,
        "p": 0.97
      },
      {
        "w": "con",
        "t": 20540,
        "d": 80,
        "p": 0.97
      },
      {
        "w": "el",
        "t": 20630,
        "d": 80,
        "p": 0.97
      },
      {
        "w": "anterior",
        "t": 20720,
        "d": 80,
        "p": 0.97
      }
    ],
    "avg_logprob": -0.12,
    "no_speech_prob": 0.03,
    "marked": false
  }
]
